{
  "$schema": "https://json-schema.org/draft/2020-12/schema",
  "$id": "https://dabbler.ai/schemas/replacement-scoreboard.schema.json",
  "title": "ReplacementScoreboard",
  "description": "Set 069 S5 - the RAW scoreboard of the automated verification surface scored against a pre-registered benchmark (benchmark-registration.json). Written as replacement-scoreboard.json. Carries the per-case outcomes (detected / replayed / falsely-REPRODUCED), the spurious-detection count (the precision denominator's false positives), and the gated-surface telemetry the Set 068 DEMOTE decision said RETIRE reopens on. It carries NO verdict: ai_router.replacement_gate.score_benchmark derives recall/precision/replay-success/false-REPRODUCED and the cadence recommendation from the registration + this scoreboard, so the verdict is derived, never hand-asserted. The runtime contract is the pure-Python validator ai_router.replacement_gate.validate_scoreboard.",
  "type": "object",
  "additionalProperties": false,
  "required": ["schemaVersion", "benchmarkName", "scoredAt", "outcomes", "telemetry"],
  "properties": {
    "schemaVersion": { "type": "integer", "enum": [1] },
    "benchmarkName": {
      "description": "Must match the registration's name (identity).",
      "type": "string",
      "minLength": 1,
      "pattern": "\\S"
    },
    "scoredAt": {
      "description": "ISO-8601 timestamp of scoring (after pre-registration).",
      "type": "string",
      "minLength": 1,
      "pattern": "\\S"
    },
    "notes": { "type": "string" },
    "spuriousDetections": {
      "description": "Detections that correspond to no registered case (false positives - the precision denominator). Default 0.",
      "type": "integer",
      "minimum": 0
    },
    "outcomes": {
      "description": "Per-case outcomes. Each caseId must be a registered case (score_benchmark rejects unregistered ids).",
      "type": "array",
      "minItems": 1,
      "items": { "$ref": "#/$defs/CaseOutcome" }
    },
    "telemetry": { "$ref": "#/$defs/GatedSurfaceTelemetry" }
  },
  "$defs": {
    "CaseOutcome": {
      "type": "object",
      "additionalProperties": true,
      "required": ["caseId", "detected", "replayed", "falseReproduced"],
      "properties": {
        "caseId": { "type": "string", "minLength": 1, "pattern": "\\S" },
        "detected": {
          "description": "Did the automated surface catch this defect?",
          "type": "boolean"
        },
        "replayed": {
          "description": "Of a detected defect, did it produce a valid pristine replay (a re-runnable falsifier)?",
          "type": "boolean"
        },
        "falseReproduced": {
          "description": "Was this detection wrongly tagged REPRODUCED without a valid replay (the integrity metric)?",
          "type": "boolean"
        }
      }
    },
    "GatedSurfaceTelemetry": {
      "type": "object",
      "description": "The telemetry of the gated verification surface - the data the Set 068 DEMOTE decision said RETIRE reopens on.",
      "additionalProperties": true,
      "required": [
        "escapedDefectRate",
        "falsePositiveChurn",
        "predicateShouldHaveFiredMisses",
        "timing"
      ],
      "properties": {
        "escapedDefectRate": {
          "description": "Fraction of real defects that escaped the gated surface (in [0, 1]).",
          "type": "number",
          "minimum": 0,
          "maximum": 1
        },
        "falsePositiveChurn": {
          "description": "False-positive churn (a non-negative rate or count of spurious findings the surface produced).",
          "type": "number",
          "minimum": 0
        },
        "predicateShouldHaveFiredMisses": {
          "description": "Count of cases where the blast-radius predicate should have fired but did not.",
          "type": "integer",
          "minimum": 0
        },
        "reworkSaved": {
          "description": "Optional measure of rework saved (e.g. defects caught at intro stage rather than end-of-set).",
          "type": "number",
          "minimum": 0
        },
        "timing": {
          "type": "object",
          "additionalProperties": true,
          "required": ["introStageCatches", "endOfSetCatches"],
          "properties": {
            "introStageCatches": {
              "description": "Defects caught at the intro (in-snippet) stage.",
              "type": "integer",
              "minimum": 0
            },
            "endOfSetCatches": {
              "description": "Defects caught only at the end-of-set (cross-file) stage.",
              "type": "integer",
              "minimum": 0
            }
          }
        }
      }
    }
  }
}
