{
  "schemaVersion": 1,
  "benchmarkName": "pull-critique-replacement-2026-06",
  "scoredAt": "2026-06-16T13:30:00-04:00",
  "spuriousDetections": 1,
  "notes": "Raw outcomes only. The verdict (recall/precision/cadence) is derived by ai_router.replacement_gate.score_benchmark, not asserted here.",
  "outcomes": [
    { "caseId": "S1", "detected": true, "replayed": true, "falseReproduced": false },
    { "caseId": "S2", "detected": true, "replayed": true, "falseReproduced": false },
    { "caseId": "H1", "detected": true, "replayed": true, "falseReproduced": false },
    { "caseId": "H2", "detected": false, "replayed": false, "falseReproduced": false }
  ],
  "telemetry": {
    "escapedDefectRate": 0.25,
    "falsePositiveChurn": 1,
    "predicateShouldHaveFiredMisses": 0,
    "reworkSaved": 2,
    "timing": {
      "introStageCatches": 2,
      "endOfSetCatches": 1
    }
  }
}
